review,score
"They welcomed my pet with open arms, making sure our stay was enjoyable and comfortable. ",7
"The neighborhood had parks and pet-friendly spaces, allowing my pet to have a great time. ",7
"Unfortunately, the Airbnb did not allow pets, which was disappointing as a pet owner. ",3
"There were limited pet-friendly facilities nearby, making it challenging to cater to my pet's needs. ",3
"The host had strict pet policies, restricting the convenience for pet owners. ",3
I struggled to find suitable pet-friendly areas for walking and exercise in the vicinity. ,3
"The Airbnb did not provide any amenities or considerations for pets, which was a letdown. ",3
"They were attentive, responsive, and made sure I had everything I needed for a pleasant stay. ",7
The host went above and beyond to make me feel welcome and gave great local recommendations. ,7
"Unfortunately, the host was unresponsive and lacked professionalism, impacting my experience negatively. ",3
I had difficulties reaching the host when I needed assistance or had questions during my stay. ,3
"The host was unaccommodating and did not address my concerns adequately, which was disappointing. ",3
"I felt unwelcome by the host, with limited communication and a lack of support throughout my visit. ",3
The host was unhelpful and showed a lack of interest in ensuring a comfortable stay. ,3
"I loved how this Airbnb was tucked away in a quiet neighborhood, providing a peaceful retreat after a long day of exploring. ",7
"The Airbnb was conveniently located near public transportation, making it a breeze to get around the city. ",7
"Unfortunately, the Airbnb was situated in a less desirable area, far from the main tourist spots. ",3
The neighborhood lacked a vibrant atmosphere and didn't offer much in terms of nearby amenities. ,3
"I found the Airbnb to be too far from restaurants and shops, making it inconvenient for dining out. ",3
"The location of the Airbnb was noisy, with constant traffic and street noise disturbing my peace. ",3
"I felt unsafe walking around the neighborhood at night, which dampened my overall experience. ",3
"I was impressed by the meticulous attention to cleanliness, making my stay feel hygienic and comfortable. ",7
"The host consistently kept the Airbnb clean and tidy throughout my visit, which I greatly appreciated. ",7
"Unfortunately, the cleanliness of the Airbnb fell short, with noticeable dirt and dust in some areas. ",3
"There were lingering odors in the Airbnb, indicating that proper cleaning measures were not taken. ",3
"I noticed stains and marks on the furniture and surfaces, suggesting a lack of thorough cleaning. ",3
"The bathroom in the Airbnb could have been cleaner, as I found it to be less than satisfactory. ",3
"The kitchen had some cleanliness issues, such as greasy countertops and dirty utensils. ",3
I enjoyed exploring the local attractions and discovering hidden gems in the charming neighborhood. ,7
"The Airbnb was nestled in a picturesque neighborhood, offering a serene and relaxing atmosphere. ",7
"Unfortunately, the immediate neighborhood lacked amenities and didn't have much to offer in terms of convenience. ",3
"There were safety concerns in the neighborhood, making me feel uneasy during my stay. ",3
"The neighborhood was noisy, with disruptive sounds and activities that affected my overall experience. ",3
"I expected more shops and services in the neighborhood, but it was relatively limited in terms of options. ",3
The cleanliness of the neighborhood streets and public spaces could have been better maintained. ,3
"The Airbnb had secure access control and a reliable security system, ensuring peace of mind throughout my stay. ",7
"The neighborhood had a strong sense of security, with well-lit streets and a low crime rate. ",7
"Unfortunately, the security measures in the Airbnb were inadequate, raising concerns about my personal safety. ",3
"I had reservations about the safety of the neighborhood, particularly during nighttime hours. ",3
"The Airbnb lacked visible security features, making me question the overall safety and protection. ",3
I didn't feel entirely comfortable due to the lack of proper security measures both inside and outside the Airbnb. ,3
"The neighborhood had a history of security incidents, which affected my peace of mind during the stay. ",3
"They went above and beyond to accommodate my pet's needs, making our stay enjoyable and stress-free. ",7
"The neighborhood had beautiful parks and walking trails, perfect for outdoor activities with my pet. ",7
"Unfortunately, the Airbnb did not allow pets, which was disappointing as a pet owner. ",3
"There were limited pet-friendly facilities in the vicinity, making it challenging to cater to my pet's needs. ",3
"The host had strict pet policies, which restricted the convenience and comfort for pet owners. ",3
I struggled to find suitable pet-friendly areas near the Airbnb for exercise and playtime. ,3
"The Airbnb didn't provide any specific amenities or considerations for pets, which was a letdown. ",3
"They were incredibly responsive and attentive, addressing all my inquiries and needs promptly. ",7
The host gave fantastic local recommendations and made me feel like a valued guest throughout my stay. ,7
"Unfortunately, the host was unresponsive and lacked the necessary professionalism, impacting my overall experience. ",3
I experienced difficulties in reaching the host when I needed assistance or had questions during my stay. ,3
"The host was unaccommodating and did not adequately address my concerns, which was disappointing. ",3
"I felt unwelcome by the host, with minimal communication and a lack of support throughout my visit. ",3
The host was unhelpful and showed a lack of interest in ensuring a comfortable and enjoyable stay. ,3
